article_time_str,article_time_datetime,link,title
2025-06-04T15:08,2025-06-04 15:08:00,https://www.interfax.ru//business/1029517,"Совет директоров ""Абрау-Дюрсо"" рекомендовал дивиденды за 2024 год в 5,01 руб. на акцию"
2025-06-04T15:04,2025-06-04 15:04:00,https://www.interfax.ru//business/1029511,"Апелляция поддержала отказ взыскать с ""Тройка-Д банка"" и четырех физлиц 1,5 млрд руб."
2025-06-04T15:00,2025-06-04 15:00:00,https://www.interfax.ru//business/1029514,ЕК объявила о готовности Болгарии перейти на евро с 1 января 2026 года
2025-06-04T14:43,2025-06-04 14:43:00,https://www.interfax.ru//business/1029510,Ford отзывает 492 тыс. внедорожников Explorer и 64 тыс. пикапов Maverick
2025-06-04T14:37,2025-06-04 14:37:00,https://www.interfax.ru//world/1029509,Правительство Германии одобрило пакет налоговых льгот для компаний на 46 млрд евро
2025-06-04T14:31,2025-06-04 14:31:00,https://www.interfax.ru//business/1029507,Американская Brookfield инвестирует до $10 млрд в создание дата-центра в Швеции
2025-06-04T14:24,2025-06-04 14:24:00,https://www.interfax.ru//business/1029505,Ставки по ипотеке в США снизились впервые за четыре недели
2025-06-04T14:12,2025-06-04 14:12:00,https://www.interfax.ru//world/1029502,Румыния не сможет быстро отказаться от угля в производстве электроэнергии
2025-06-04T14:03,2025-06-04 14:03:00,https://www.interfax.ru//business/1029498,Золото умеренно дорожает на сохранении неопределенности вокруг пошлин
2025-06-04T13:47,2025-06-04 13:47:00,https://www.interfax.ru//business/1029491,Иммобилизованные активы в Сбере составляют меньше 25% капитала
2025-06-04T13:43,2025-06-04 13:43:00,https://www.interfax.ru//business/1029490,"Надбавка за системную значимость для Сбербанка может вырасти до 2,5%"
2025-06-04T13:21,2025-06-04 13:21:00,https://www.interfax.ru//business/1029483,"Число физлиц с брокерскими счетами на Мосбирже в мае выросло на 287 тыс. до 36,9 млн"
2025-06-04T12:34,2025-06-04 12:34:00,https://www.interfax.ru//business/1029465,"""Газпром"" отметил, что ситуация с закачкой газа в ПХГ Европы становится все более напряженной"
2025-06-04T12:21,2025-06-04 12:21:00,https://www.interfax.ru//russia/1029462,"Минпромторг рассчитывает на скорейшее начало обсуждения законопроекта о ""российской полке"""
2025-06-04T12:17,2025-06-04 12:17:00,https://www.interfax.ru//business/1029461,"Цена Urals в мае для расчета НДПИ определена на уровне $52,08/баррель"
2025-06-04T12:15,2025-06-04 12:15:00,https://www.interfax.ru//business/1029459,В АЕБ прокомментировали майский спад продаж в России новых автомобилей
2025-06-04T12:11,2025-06-04 12:11:00,https://www.interfax.ru//business/1029457,"Нефтяники РФ в мае получили по демпферу 42,5 млрд рублей"
2025-06-04T12:08,2025-06-04 12:08:00,https://www.interfax.ru//world/1029456,Норвегия сократила экспорт морепродуктов в мае впервые за 11 месяцев
2025-06-04T12:07,2025-06-04 12:07:00,https://www.interfax.ru//russia/1029454,"""Ростсельмашу"" для отказа от неоплачиваемых отпусков нужно продавать от 400 машин в месяц"
2025-06-04T12:04,2025-06-04 12:04:00,https://www.interfax.ru//business/1029453,"Минфин РФ с 6 июня уменьшит объем покупки валюты/золота до 1,5 млрд руб. в день"
2025-06-04T11:56,2025-06-04 11:56:00,https://www.interfax.ru//business/1029451,"Сбер, ВТБ, ГПБ и Совкомбанк в мае получили суборды на 300 млрд руб. из ФНБ на ВСМ Москва-Петербург"
2025-06-04T11:39,2025-06-04 11:39:00,https://www.interfax.ru//business/1029443,"Объем ФНБ в мае сократился на 95,43 млрд рублей до 11,696 трлн рублей"
2025-06-04T11:18,2025-06-04 11:18:00,https://www.interfax.ru//business/1029444,Акционеры Warner Bros. проголосовали против выплаты главе компании $52 млн
2025-06-04T11:05,2025-06-04 11:05:00,https://www.interfax.ru//business/1029441,ФРС сняла установленное из-за скандала ограничение на активы Wells Fargo
2025-06-04T10:40,2025-06-04 10:40:00,https://www.interfax.ru//business/1029436,"Т-Банк отметил, что самозапреты почти не повлияли на его динамику выдач кредитов"
2025-06-04T10:16,2025-06-04 10:16:00,https://www.interfax.ru//business/1029434,"Remy Cointreau за фингод снизила чистую прибыль на треть, выручку - на 18%"
2025-06-04T10:15,2025-06-04 10:15:00,https://www.interfax.ru//business/1029433,"Индексы МосБиржи и РТС подросли на 0,7% в начале основной сессии торгов"
2025-06-04T10:10,2025-06-04 10:10:00,https://www.interfax.ru//business/1029432,Рубль утром в среду немного повышается в паре с юанем на МосБирже
2025-06-04T10:07,2025-06-04 10:07:00,https://www.interfax.ru//business/1029431,МТС-банк разместил ЦФА на 5 млрд рублей
2025-06-04T09:57,2025-06-04 09:57:00,https://www.interfax.ru//business/1029428,Китай обсуждает возможность заказа в июле нескольких сотен самолетов Airbus
2025-06-04T09:27,2025-06-04 09:27:00,https://www.interfax.ru//business/1029425,HP Enterprise во II финквартале получила выручку и скорр. прибыль выше прогноза
2025-06-04T09:13,2025-06-04 09:13:00,https://www.interfax.ru//business/1029423,"Индекс PMI сферы услуг РФ в мае поднялся до 52,2 пункта с 50,1 пункта в апреле"
2025-06-04T08:40,2025-06-04 08:40:00,https://www.interfax.ru//business/1029421,"Нефть Brent подешевела до $65,38 за баррель после роста цен в предыдущие два дня"
2025-06-04T08:23,2025-06-04 08:23:00,https://www.interfax.ru//business/1029419,"Продажи Lada в РФ в мае просели сильнее, чем у основных китайских марок"
2025-06-04T07:42,2025-06-04 07:42:00,https://www.interfax.ru//business/1029411,"Рынок акций РФ открылся в утреннюю сессию ростом индекса IMOEX2 на 0,5%"
2025-06-04T07:25,2025-06-04 07:25:00,https://www.interfax.ru//business/1029408,Уолл-стрит закрылась уверенным ростом
2025-06-04T01:56,2025-06-04 01:56:00,https://www.interfax.ru//world/1029402,Трамп повысил пошлины на импорт в США стали и алюминия с 25% до 50%
2025-06-03T20:00,2025-06-03 20:00:00,https://www.interfax.ru//business/1029381,"""Т-Технологии"" не исключили коммерческого партнерства с ""Яндексом"""
2025-06-03T19:26,2025-06-03 19:26:00,https://www.interfax.ru//business/1029375,ВТБ пробил кворум по рублификации бондов СУБ-Т1-2 на 190 млн евро
2025-06-03T19:17,2025-06-03 19:17:00,https://www.interfax.ru//business/1029373,Рубль во вторник немного опустился в паре с юанем
2025-06-03T19:09,2025-06-03 19:09:00,https://www.interfax.ru//business/1029372,"""Т-Технологии"" не видят рисков приостановки ежеквартальной выплаты дивидендов"
2025-06-03T18:59,2025-06-03 18:59:00,https://www.interfax.ru//world/1029370,"Ирландская сеть отелей Dalata отказалась от продажи консорциуму инвесторов за 1,3 млрд евро"
2025-06-03T18:59,2025-06-03 18:59:00,https://www.interfax.ru//business/1029371,Рынок акций РФ во вторник превысил 2830п по индексу МосБиржи на фоне роста нефти
2025-06-03T18:42,2025-06-03 18:42:00,https://www.interfax.ru//world/1029364,Uber назначила COO впервые с 2019 года
2025-06-03T18:33,2025-06-03 18:33:00,https://www.interfax.ru//world/1029360,В Латвии утвердили энергостратегию до 2050 года о росте энергопотребления почти в 3 раза
2025-06-03T18:23,2025-06-03 18:23:00,https://www.interfax.ru//business/1029362,РЖД в ближайшее время станут финансировать проекты по развитию со своего баланса
2025-06-03T18:14,2025-06-03 18:14:00,https://www.interfax.ru//business/1029361,"Нефть ускорила рост, Brent подорожала до $65,72 за баррель"
2025-06-03T17:48,2025-06-03 17:48:00,https://www.interfax.ru//business/1029355,Merck проявляла интерес к покупке швейцарской MoonLake более чем за $3 млрд
