article_time_str,article_time_datetime,link,title
2025-06-05T17:01,2025-06-05 17:01:00,https://www.interfax.ru//business/1029823,"Бывший завод ""Ставрополь Авто"" продали на торгах за 2,25 млрд рублей"
2025-06-05T16:59,2025-06-05 16:59:00,https://www.interfax.ru//business/1029825,Сталепроизводители в мае сократили объем экспорта по сети РЖД почти на 10% м/м
2025-06-05T16:56,2025-06-05 16:56:00,https://www.interfax.ru//business/1029824,"""Газпром"" после десяти лет попыток продал жилой комплекс на Кубани"
2025-06-05T16:52,2025-06-05 16:52:00,https://www.interfax.ru//business/1029822,"Лагард заявила, что ЕЦБ приближается к окончанию цикла снижения ставок"
2025-06-05T16:45,2025-06-05 16:45:00,https://www.interfax.ru//russia/1029818,Власти договорились о строительстве международного терминала в аэропорту Челябинска
2025-06-05T16:31,2025-06-05 16:31:00,https://www.interfax.ru//business/1029817,Лагард твердо намерена остаться руководителем ЕЦБ до конца срока
2025-06-05T16:27,2025-06-05 16:27:00,https://www.interfax.ru//business/1029816,Решение ЕЦБ снизить ставки на 25 б.п. было почти единогласным
2025-06-05T16:24,2025-06-05 16:24:00,https://www.interfax.ru//business/1029814,"""Акрон"" в 2024 году сохранил capex почти на прошлогоднем уровне - $0,5 млрд"
2025-06-05T16:12,2025-06-05 16:12:00,https://www.interfax.ru//russia/1029812,"Из шахты ""Листвяжная"" ""СДС-Угля"" вывели всех горняков из-за пожара на подстанции"
2025-06-05T16:11,2025-06-05 16:11:00,https://www.interfax.ru//business/1029810,"Международные резервы России с 23 по 30 мая увеличились на $0,2 млрд"
2025-06-05T16:03,2025-06-05 16:03:00,https://www.interfax.ru//business/1029808,В Индонезии ввели меры стимулирования потребления
2025-06-05T16:03,2025-06-05 16:03:00,https://www.interfax.ru//world/1029806,Объем золота в ETF в мае снизился на 19 т
2025-06-05T16:01,2025-06-05 16:01:00,https://www.interfax.ru//business/1029807,Dr. Martens снизил годовую выручку на 10%
2025-06-05T15:58,2025-06-05 15:58:00,https://www.interfax.ru//business/1029805,В США в I квартале производительность труда упала сильнее прогноза
2025-06-05T15:50,2025-06-05 15:50:00,https://www.interfax.ru//russia/1029801,"Юлия Высоцкая стала совладельцем более чем 40 компаний сети аптек ""Планета здоровья"""
2025-06-05T15:43,2025-06-05 15:43:00,https://www.interfax.ru//business/1029799,Kimberly-Clark подтвердила продажу части зарубежного бизнеса по выпуску бумажной продукции
2025-06-05T15:42,2025-06-05 15:42:00,https://www.interfax.ru//world/1029800,"Внешнеторговый дефицит США в апреле упал в 2,2 раза до минимума с августа 2023 года"
2025-06-05T15:39,2025-06-05 15:39:00,https://www.interfax.ru//business/1029798,В США число заявок на пособие по безработице неожиданно выросло до максимума с октября
2025-06-05T15:37,2025-06-05 15:37:00,https://www.interfax.ru//business/1029796,"""Газпром"" увеличил полезное использование попутного газа в 2024 году"
2025-06-05T15:34,2025-06-05 15:34:00,https://www.interfax.ru//business/1029795,"Банк России отметил замедление роста числа ""квалов"" после повышения имущественного ценза"
2025-06-05T15:29,2025-06-05 15:29:00,https://www.interfax.ru//business/1029794,ЕЦБ снизил прогноз инфляции в еврозоне на 2025-2026 годы
2025-06-05T15:28,2025-06-05 15:28:00,https://www.interfax.ru//business/1029793,Европейский центральный банк снизил процентные ставки на 25 базисных пунктов
2025-06-05T15:26,2025-06-05 15:26:00,https://www.interfax.ru//business/1029791,"Средняя максимальная ставка по вкладам топ-10 банков в III декаде мая опустилась до 19,39%"
2025-06-05T15:18,2025-06-05 15:18:00,https://www.interfax.ru//business/1029788,"Официальная оценка численности персонала ""Газпрома"" в 2024 году значительно выросла"
2025-06-05T15:09,2025-06-05 15:09:00,https://www.interfax.ru//russia/1029784,Минэнерго оценит состояние угольной отрасли после II квартала
2025-06-05T15:06,2025-06-05 15:06:00,https://www.interfax.ru//business/1029785,"""Газпром"" в 2024 году увеличил поставки газа в Узбекистан на 4,4 млрд куб. м"
2025-06-05T15:04,2025-06-05 15:04:00,https://www.interfax.ru//business/1029783,"Brent подорожала до $65,06 за баррель"
2025-06-05T14:57,2025-06-05 14:57:00,https://www.interfax.ru//russia/1029780,"Подрядчик хочет через суд взыскать с Якутугля ""Мечела"" 4,2 млрд рублей"
2025-06-05T14:53,2025-06-05 14:53:00,https://www.interfax.ru//russia/1029779,"Потребление газа в России в 2024 году выросло на 5,2%, до 521,5 млрд кубометров"
2025-06-05T14:44,2025-06-05 14:44:00,https://www.interfax.ru//business/1029777,"Petronas сообщила, что не будет выходить из канадского бизнеса"
2025-06-05T14:36,2025-06-05 14:36:00,https://www.interfax.ru//russia/1029773,"Власти Кузбасса хотят гарантий, что бонусы от льгот для углепрома получат именно угольщики"
2025-06-05T14:00,2025-06-05 14:00:00,https://www.interfax.ru//business/1029760,"Инфляция в ОЭСР в апреле осталась на минимуме с июля 2021 г. - 4,2%"
2025-06-05T13:46,2025-06-05 13:46:00,https://www.interfax.ru//business/1029758,Несколько банков Казахстана запустили криптокарты
2025-06-05T13:41,2025-06-05 13:41:00,https://www.interfax.ru//business/1029754,Нацбанк Казахстана ухудшил прогноз цены Brent на 2025 год до $65 за баррель
2025-06-05T13:41,2025-06-05 13:41:00,https://www.interfax.ru//business/1029756,Апелляция отказала Богданчикову в иске к Т-банку о переводе акций
2025-06-05T13:26,2025-06-05 13:26:00,https://www.interfax.ru//world/1029752,Китайский регулятор задерживает рассмотрение совместных ИИ-продуктов Apple и Alibaba
2025-06-05T13:21,2025-06-05 13:21:00,https://www.interfax.ru//business/1029749,"""Микран"" ликвидирует компанию-оператора фабрики микросхем"
2025-06-05T13:08,2025-06-05 13:08:00,https://www.interfax.ru//business/1029748,Оценка инфляции в Великобритании в апреле была завышена из-за ошибок в расчетах
2025-06-05T12:15,2025-06-05 12:15:00,https://www.interfax.ru//business/1029736,Трейдер Trafigura сократил полугодовую выручку на 4% при росте прибыли
2025-06-05T12:12,2025-06-05 12:12:00,https://www.interfax.ru//business/1029735,Пекин заявил об ущербе международной торговле из-за пошлин США на сталь и алюминий
2025-06-05T12:08,2025-06-05 12:08:00,https://www.interfax.ru//world/1029732,"В Таиланде не исключают запуска оплаты картами ""Мир"""
2025-06-05T12:07,2025-06-05 12:07:00,https://www.interfax.ru//business/1029733,"""Ростелеком"" разместил ЦФА на 3 млрд рублей под 21,4% годовых"
2025-06-05T11:58,2025-06-05 11:58:00,https://www.interfax.ru//russia/1029728,Российский агробизнес за пять лет вложил 17 млрд руб. в социальное развитие села
2025-06-05T11:58,2025-06-05 11:58:00,https://www.interfax.ru//business/1029730,Procter & Gamble планирует сократить 7 тысяч рабочих мест за два года
2025-06-05T11:52,2025-06-05 11:52:00,https://www.interfax.ru//business/1029729,"Citigroup сократит 3,5 тысячи технологических специалистов в Китае"
2025-06-05T11:44,2025-06-05 11:44:00,https://www.interfax.ru//business/1029726,В России число выданных ипотек на индивидуальное жилье упало в четыре раза
2025-06-05T11:32,2025-06-05 11:32:00,https://www.interfax.ru//world/1029724,Индонезия задумалась о покупке у Китая истребителей J-10
2025-06-05T11:31,2025-06-05 11:31:00,https://www.interfax.ru//business/1029725,Еврокомиссия разрешит UniCredit купить конкурирующий Banco BPM
2025-06-05T11:08,2025-06-05 11:08:00,https://www.interfax.ru//business/1029720,"""Новая перевозочная компания"" меняет гендиректора"
2025-06-05T11:01,2025-06-05 11:01:00,https://www.interfax.ru//business/1029717,"Kimberly-Clark продаст зарубежные активы по выпуску салфеток за $3,5 млрд"
2025-06-05T10:54,2025-06-05 10:54:00,https://www.interfax.ru//business/1029716,"Владельцы облигаций ЛК ""Эволюция"" получили право требовать досрочного погашения бондов"
2025-06-05T10:45,2025-06-05 10:45:00,https://www.interfax.ru//russia/1029713,В Челябинске закрытие электродного производства ЧЭМК завершится к июлю
2025-06-05T10:35,2025-06-05 10:35:00,https://www.interfax.ru//business/1029712,МосБиржа 10 июня запустит фьючерсы на апельсиновый сок
2025-06-05T10:14,2025-06-05 10:14:00,https://www.interfax.ru//business/1029710,"Основная сессия на ""Мосбирже"" открылась ростом индексов на 0,6%"
2025-06-05T10:13,2025-06-05 10:13:00,https://www.interfax.ru//business/1029708,"Рубль немного подешевел к доллару, участники рынка ждут пятничного заседания ЦБ по ставке"
2025-06-05T10:11,2025-06-05 10:11:00,https://www.interfax.ru//russia/1029709,Хуснуллин не исключил сильное сокращение ввода жилья в 2027 году
2025-06-05T10:06,2025-06-05 10:06:00,https://www.interfax.ru//business/1029706,"Число пользователей Whoosh в Южной Америке за 5 месяцев выросло в 2,9 раза"
2025-06-05T09:55,2025-06-05 09:55:00,https://www.interfax.ru//business/1029703,"""Аэрофлот"" надеется к июлю завершить страховое урегулирование по 36 самолетам"
2025-06-05T09:37,2025-06-05 09:37:00,https://www.interfax.ru//russia/1029701,Fix Price объявила о начале обмена GDR на акции российского ПАО
2025-06-05T09:04,2025-06-05 09:04:00,https://www.interfax.ru//business/1029696,"Заказы промпредприятий Германии в апреле неожиданно выросли на 0,6%"
2025-06-05T08:58,2025-06-05 08:58:00,https://www.interfax.ru//business/1029695,"""Эйч энд Эн"" увеличил выпуск современной молочной продукции на 27%, традиционной - на 14%"
2025-06-05T08:40,2025-06-05 08:40:00,https://www.interfax.ru//business/1029694,"Оценка спада ВВП Южной Кореи в I квартале подтверждена на уровне 0,2%"
2025-06-05T08:37,2025-06-05 08:37:00,https://www.interfax.ru//business/1029693,"Brent подешевела до $64,71 за баррель"
2025-06-05T07:23,2025-06-05 07:23:00,https://www.interfax.ru//russia/1029683,Рынок акций РФ открылся в утреннюю сессию незначительным изменением индекса IMOEX2
2025-06-05T06:38,2025-06-05 06:38:00,https://www.interfax.ru//world/1029680,Экономическая активность в США немного снизилась в конце весны
2025-06-05T06:34,2025-06-05 06:34:00,https://www.interfax.ru//world/1029679,Фондовые индексы США завершили торги среды без единой динамики
2025-06-05T06:02,2025-06-05 06:02:00,https://www.interfax.ru//world/1029677,Европейские рынки акций в основном завершили сессию в плюсе
2025-06-04T21:52,2025-06-04 21:52:00,https://www.interfax.ru//world/1029650,Маск призвал полностью переделать предложенный Трампом проект бюджета США
2025-06-04T21:38,2025-06-04 21:38:00,https://www.interfax.ru//business/1029644,"""Мосбиржа"" допустила акции ""Фикс прайс"" к торгам с 9 июля"
2025-06-04T21:33,2025-06-04 21:33:00,https://www.interfax.ru//business/1029648,Трамп выступил за отказ от лимита госдолга США
2025-06-04T20:29,2025-06-04 20:29:00,https://www.interfax.ru//business/1029635,Amazon инвестирует $10 млрд в ИИ-инфраструктуру в Северной Каролине
2025-06-04T20:23,2025-06-04 20:23:00,https://www.interfax.ru//world/1029634,Еврокомиссия выделит 175 млн евро для восстановления в Сирии
2025-06-04T20:21,2025-06-04 20:21:00,https://www.interfax.ru//world/1029633,GIA в 2025 году прекратит оценивать искусственные бриллианты по стандартам натуральных
2025-06-04T20:11,2025-06-04 20:11:00,https://www.interfax.ru//business/1029630,Саудовская Аравия в июле существенно повысит цены на нефть для Европы
2025-06-04T20:05,2025-06-04 20:05:00,https://www.interfax.ru//russia/1029629,"Минэнерго заявило, что внутренний рынок России полностью обеспечен автомобильным топливом"
2025-06-04T19:49,2025-06-04 19:49:00,https://www.interfax.ru//business/1029626,Большинство экспертов ждут сохранения ставки Банка России на уровне 21%
2025-06-04T19:41,2025-06-04 19:41:00,https://www.interfax.ru//russia/1029625,"Госпакет ""Корпорации морского приборостроения"" для передачи ОСК оценен в 61 млрд рублей"
2025-06-04T19:39,2025-06-04 19:39:00,https://www.interfax.ru//business/1029624,"Производство полимеров в РФ в апреле выросло на 2,2% г/г, каучуков – на 0,9%"
2025-06-04T19:38,2025-06-04 19:38:00,https://www.interfax.ru//russia/1029623,"Глава Картофельного союза увидел тенденцию к снижению стоимости ""борщевого набора"""
2025-06-04T19:37,2025-06-04 19:37:00,https://www.interfax.ru//business/1029622,"Перевозки грузов речным транспортом в РФ в апреле сократились на 39,3% г/г"
2025-06-04T19:36,2025-06-04 19:36:00,https://www.interfax.ru//russia/1029621,Туроператоры сообщили о росте спроса на шенгенские визы на 50-60% в 2025 году
2025-06-04T19:35,2025-06-04 19:35:00,https://www.interfax.ru//business/1029620,"Грузооборот транспорта в РФ снизился в январе-апреле на 0,1%, в апреле – вырос на 1,6%"
2025-06-04T19:33,2025-06-04 19:33:00,https://www.interfax.ru//russia/1029619,"Росстат сообщил о росте цены производителей на бензин в апреле на 2,2%"
2025-06-04T19:32,2025-06-04 19:32:00,https://www.interfax.ru//business/1029618,"Производство сельхозпродукции в РФ в апреле выросло на 1,4%, за 4 месяца – на 1,6%"
2025-06-04T19:24,2025-06-04 19:24:00,https://www.interfax.ru//business/1029615,"Объем каршеринговых услуг в РФ в апреле вырос на 7,3%"
2025-06-04T19:21,2025-06-04 19:21:00,https://www.interfax.ru//russia/1029614,"Денежная масса в России в мае выросла на 0,7%, годовой темп увеличился до 15,4%"
2025-06-04T19:20,2025-06-04 19:20:00,https://www.interfax.ru//russia/1029612,"Рубль на волатильных торгах среды на ""Мосбирже"" подешевел к юаню"
2025-06-04T19:20,2025-06-04 19:20:00,https://www.interfax.ru//business/1029613,"Минэкономразвития зафиксировало рост ВВП РФ в апреле до 1,9%"
2025-06-04T19:16,2025-06-04 19:16:00,https://www.interfax.ru//business/1029610,"Доля прибыльных хозяйств в растениеводстве и животноводстве в I квартале выросла до 79,4%"
2025-06-04T19:16,2025-06-04 19:16:00,https://www.interfax.ru//business/1029611,Сальдированная прибыль розничной торговли РФ в I квартале выросла на 15%
2025-06-04T19:15,2025-06-04 19:15:00,https://www.interfax.ru//business/1029608,"Сальдированная прибыль предприятий РФ за I квартал выросла на 4,2%"
2025-06-04T19:14,2025-06-04 19:14:00,https://www.interfax.ru//business/1029609,"Бензин в России с 27 мая по 2 июня подорожал на 0,11%"
2025-06-04T19:11,2025-06-04 19:11:00,https://www.interfax.ru//business/1029606,"Предпринимательская уверенность в России в мае снизилась и в добыче, и в обработке"
2025-06-04T19:11,2025-06-04 19:11:00,https://www.interfax.ru//business/1029607,"Рост выпуска по базовым видам деятельности в РФ в апреле ускорился до 2,0% с 0,9% в марте"
2025-06-04T19:09,2025-06-04 19:09:00,https://www.interfax.ru//business/1029604,"Инвестиции в основной капитал в РФ в I квартале выросли на 8,7%"
2025-06-04T19:08,2025-06-04 19:08:00,https://www.interfax.ru//business/1029605,"Оборот розничной торговли России в апреле вырос на 1,9%"
2025-06-04T19:07,2025-06-04 19:07:00,https://www.interfax.ru//business/1029603,В России рост цен на картофель почти остановился
2025-06-04T19:06,2025-06-04 19:06:00,https://www.interfax.ru//business/1029602,Рост цен на курятину в РФ продолжает замедляться
2025-06-04T19:04,2025-06-04 19:04:00,https://www.interfax.ru//business/1029600,"Рост зарплат в РФ в марте замедлился до 0,1% в реальном выражении с 3,2% в феврале"
2025-06-04T19:04,2025-06-04 19:04:00,https://www.interfax.ru//russia/1029601,"Сальдированный убыток угольных компаний в I квартале составил 79,9 млрд рублей"
2025-06-04T19:03,2025-06-04 19:03:00,https://www.interfax.ru//business/1029598,"Инфляция в России с 27 мая по 2 июня составила 0,05%, годовая замедлилась до 9,7%"
2025-06-04T19:02,2025-06-04 19:02:00,https://www.interfax.ru//business/1029599,"Безработица в РФ в апреле осталась на достигнутом в марте минимальном уровне в 2,3%"
2025-06-04T18:59,2025-06-04 18:59:00,https://www.interfax.ru//business/1029597,Российский рынок акций прервал рост после заявлений Путина об Украине
2025-06-04T18:44,2025-06-04 18:44:00,https://www.interfax.ru//world/1029593,"Банк Канады сохранил ключевую ставку на уровне 2,75 б.п"
2025-06-04T18:44,2025-06-04 18:44:00,https://www.interfax.ru//business/1029592,Саудовская Аравия хочет продолжения ускоренного наращивания квот ОПЕК+
2025-06-04T18:22,2025-06-04 18:22:00,https://www.interfax.ru//business/1029587,Бюджетное управление Конгресса снизило оценку роста госдолга США из-за налоговой реформы
2025-06-04T18:20,2025-06-04 18:20:00,https://www.interfax.ru//business/1029585,"""СПБ биржа"" не будет проводить торги 5 июля"
2025-06-04T18:19,2025-06-04 18:19:00,https://www.interfax.ru//business/1029583,"Апелляционный суд Англии отклонил жалобу Магомедова к ""Транснефти"" о продаже НМТП"
2025-06-04T18:16,2025-06-04 18:16:00,https://www.interfax.ru//business/1029584,Чипмейкер GlobalFoundries вложит $16 млрд в расширение производства в США
2025-06-04T18:13,2025-06-04 18:13:00,https://www.interfax.ru//business/1029582,"Brent подешевела до $65,37 за баррель"
2025-06-04T17:47,2025-06-04 17:47:00,https://www.interfax.ru//russia/1029570,ФАС предлагает обязать рыбаков регистрировать внебиржевые сделки на 19 видов продукции
2025-06-04T17:44,2025-06-04 17:44:00,https://www.interfax.ru//business/1029569,"Верховный суд РФ признал неправомерными ""вечные"" проценты по займу"
2025-06-04T17:41,2025-06-04 17:41:00,https://www.interfax.ru//business/1029567,"Запасы нефти в США сократились на 4,3 млн баррелей за неделю"
2025-06-04T17:21,2025-06-04 17:21:00,https://www.interfax.ru//business/1029559,Мосбиржа с 6 июня добавит 8 акций на утренние и вечерние торги
2025-06-04T17:10,2025-06-04 17:10:00,https://www.interfax.ru//world/1029553,Индекс активности в сфере услуг США в мае упал ниже 50 пунктов впервые с июня
2025-06-04T16:51,2025-06-04 16:51:00,https://www.interfax.ru//business/1029544,Акционеры ТМК одобрили рекомендацию не выплачивать дивиденды за 2024 год
2025-06-04T16:37,2025-06-04 16:37:00,https://www.interfax.ru//business/1029539,"Акционеры ""Соллерса"" утвердили выплату дивидендов за 2024 год в размере 70 руб. на акцию"
2025-06-04T16:29,2025-06-04 16:29:00,https://www.interfax.ru//business/1029537,"Трамп вновь атаковал Пауэлла в своей соцсети, потребовав снижения ставки ФРС"
2025-06-04T16:25,2025-06-04 16:25:00,https://www.interfax.ru//business/1029535,BP не исключает возможности освоения газовых запасов месторождения Карабах
2025-06-04T16:13,2025-06-04 16:13:00,https://www.interfax.ru//business/1029534,Tesla отзывает 172 электромобиля Model Y
2025-06-04T16:12,2025-06-04 16:12:00,https://www.interfax.ru//business/1029532,Иностранные авиакомпании в I кв. стали наращивать долю рынка зарубежных рейсов в РФ
2025-06-04T15:51,2025-06-04 15:51:00,https://www.interfax.ru//business/1029527,"Объединенная компания Wildberries-Russ учредила ""дочку"" в сфере факторинга"
2025-06-04T15:43,2025-06-04 15:43:00,https://www.interfax.ru//business/1029526,TotalEnergies увеличила долю в проекте Lapa на шельфе Бразилии до 48% путем обмена
2025-06-04T15:39,2025-06-04 15:39:00,https://www.interfax.ru//business/1029522,РЖД в мае зафиксировали потери в погрузке на 24 млн т из-за роста необеспеченных заявок
2025-06-04T15:34,2025-06-04 15:34:00,https://www.interfax.ru//business/1029521,Рынки и аналитики ждут снижения ставок ЕЦБ 5 июня на 25 б.п.
2025-06-04T15:10,2025-06-04 15:10:00,https://www.interfax.ru//business/1029516,"Brent стабилизировалась и торгуется у $65,6 за баррель"
